{
  "version": "2.0",
  "unit": "mm",
  "document_type": "part",
  "part_name": "p1_modify_named_dimension",
  "operations": [
    {"id": "new_001", "op": "create_new_part", "params": {}},
    {"id": "base_001", "op": "create_base_plate", "params": {"length": 120, "width": 80, "thickness": 12}},
    {"id": "modify_001", "op": "modify_named_dimension", "params": {"dimension_name": "D_base_length", "value": 150}}
  ],
  "outputs": {"save_sldprt": true, "export_step": false, "capture_png": false}
}
