{
  "version": "2.0",
  "unit": "mm",
  "document_type": "part",
  "part_name": "Installation_Plate",
  "operations": [
    {"id": "create_new_part.001", "op": "create_new_part", "params": {"part_name": "Installation_Plate"}},
    {"id": "create_base_plate.001", "op": "create_base_plate", "params": {"length": 120, "width": 80, "thickness": 15, "plane": "Top"}},
    {"id": "create_through_hole.002", "op": "create_through_hole", "params": {"plane": "top_face", "center": [10.0, 10.0], "diameter": 10, "host": "base"}},
    {"id": "create_through_hole.003", "op": "create_through_hole", "params": {"plane": "top_face", "center": [10.0, 35.0], "diameter": 10, "host": "base"}},
    {"id": "create_through_hole.004", "op": "create_through_hole", "params": {"plane": "top_face", "center": [55.0, 10.0], "diameter": 10, "host": "base"}},
    {"id": "create_through_hole.005", "op": "create_through_hole", "params": {"plane": "top_face", "center": [55.0, 35.0], "diameter": 10, "host": "base"}}
  ]
}