{
  "version": "2.0",
  "unit": "mm",
  "document_type": "part",
  "part_name": "p1_material_properties",
  "operations": [
    {"id": "new_001", "op": "create_new_part", "params": {}},
    {"id": "base_001", "op": "create_base_plate", "params": {"length": 120, "width": 80, "thickness": 12}},
    {"id": "mat_001", "op": "set_material", "params": {"material": "Aluminum_6061"}},
    {"id": "prop_001", "op": "set_custom_property", "params": {"key": "PartNumber", "value": "P1-001"}}
  ],
  "outputs": {"save_sldprt": true, "export_step": false, "capture_png": false}
}
