{
  "version": "2.0",
  "unit": "mm",
  "document_type": "part",
  "part_name": "p1_blind_hole",
  "operations": [
    {"id": "new_001", "op": "create_new_part", "params": {}},
    {"id": "base_001", "op": "create_base_plate", "params": {"length": 120, "width": 80, "thickness": 12}},
    {"id": "blind_001", "op": "create_blind_hole", "params": {"plane": "top_face", "center": [0, 0], "diameter": 8, "depth": 5}}
  ],
  "outputs": {"save_sldprt": true, "export_step": false, "capture_png": false}
}
